market,category,currency,marca,descripcion,promocion,precio_producto,precio_promocion,precio_kilo
Dia,perfumeria,ARG,DOVE,Máscara de Tratamiento DOVE REAL Poder de Las Plantas NUTRICIÓN + GERANIO 190 Ml. ,2do 50%,"$ 745,97",,3926.16KG
Dia,perfumeria,ARG,DOVE,Shampoo DOVE REAL Poder de Las Plantas PURIFICACIÓN + JENGIBRE 300 Ml. ,2do 50%,"$ 844,57",,2815.23LT
Dia,perfumeria,ARG,SEDAL,Shampoo SEDAL Hialurónico y Vit A 340 Ml. ,12%,"$ 469,00","$ 535,60",1379.41LT
Dia,perfumeria,ARG,TRESEMME,Acondicionador TRESEMME Keratina Antifrizz 500 Ml. ,,"$ 911,54",,1823.08LT
Dia,perfumeria,ARG,DOVE,Acondicionador DOVE REAL Poder de Las Plantas FUERZA + BAMBÚ 300 Ml. ,2do 50%,"$ 844,57",,2815.23LT
Dia,perfumeria,ARG,NIVEA,Desodorante antitranspirante Nivea Men Invisible Black & White Fresh Spray 150 Ml. ,25%,"$ 433,14","$ 577,52",3850.13LT
Dia,perfumeria,ARG,SEDAL,Shampoo SEDAL Carbón Activado y Peonias 340 Ml. ,13%,"$ 469,00","$ 538,70",1379.41LT
Dia,perfumeria,ARG,PANTENE,Acondicionador Pantene Pro-V Micelar Purifica e Hidrata 400 Ml. ,2do 70%,"$ 912,97",,2282.43LT
Dia,perfumeria,ARG,COLGATE,Pasta Dental Colgate Luminous White Brilliant Tub Rec 140 Gr. ,,"$ 1.214,73",,8676.64KG
Dia,perfumeria,ARG,NIVEA,Desodorante antitranspirante femenino Nivea B&W Invisible Toque de Seda Spray 150 Ml. ,,"$ 485,10",,3234.00LT
Dia,perfumeria,ARG,BONTE,Tampones Bonté Súper 16 Un. ,,"$ 504,50",,31.53UD
Dia,perfumeria,ARG,BONTE,Tampones Bonté Medio 16 Un. ,,"$ 504,50",,31.53UD
Dia,perfumeria,ARG,SEDAL,Acondicionador SEDAL Hialurónico y Vit A 340 Ml. ,12%,"$ 469,00","$ 535,60",1379.41LT
Dia,perfumeria,ARG,O.B.,Tampones OB Siempre Libre Medio 16 Un. ,,"$ 563,50",,35.22UD
Dia,perfumeria,ARG,INTIMA,Tampones Íntima Medio 8 Un. ,,"$ 232,80",,29.10UD
Dia,perfumeria,ARG,SEDAL,Shampoo SEDAL Ceramidas 340 Ml. ,12%,"$ 469,00","$ 535,60",1379.41LT
Dia,perfumeria,ARG,COLGATE,Cepillo Dental Colgate Slim Soft Black 2 Un. ,20%,"$ 685,30","$ 856,63",428.32UD
Dia,perfumeria,ARG,PANTENE,Acondicionador cabello color radiante Pantene 400 Ml. ,2do 70%,"$ 1.030,97",,2577.43LT
Dia,perfumeria,ARG,SEDAL,Acondicionador SEDAL Ceramidas 340 Ml. ,12%,"$ 469,00","$ 535,60",1379.41LT
Dia,perfumeria,ARG,DOVE,Máscara de Tratamiento DOVE REAL Poder de Las Plantas FUERZA + BAMBÚ 190 Ml. ,2do 50%,"$ 745,97",,3926.16LT
Dia,perfumeria,ARG,SEDAL,Acondicionador SEDAL Carbón Activado y Peonias 340 Ml. ,13%,"$ 469,00","$ 538,70",1379.41LT
Dia,perfumeria,ARG,BONTE,Jabón Bonté Multicolor 90 Gr c/u 3 Un. ,,"$ 297,95",,1103.52KG
Dia,perfumeria,ARG,SEDAL,Shampoo SEDAL Restauración Instantánea 340 Ml. ,12%,"$ 469,00","$ 535,60",1379.41LT
Dia,perfumeria,ARG,SEDAL,Acondicionador SEDAL Crema Balance 340 Ml. ,12%,"$ 469,00","$ 535,60",1379.41LT
Dia,perfumeria,ARG,NIVEA,Desodorante antitranspirante femenino Nivea Dry Fresh Spray 150 Ml. ,25%,"$ 416,76","$ 555,68",3704.53LT
Dia,perfumeria,ARG,FRUCTIS,Shampoo Garnier Fructis Recarga Nutritiva Oil Repair 3 350 Ml. ,2do 70%,"$ 926,57",,2647.34LT
Dia,perfumeria,ARG,ORAL B,Cepillo Dental Oral B Indicator 1 Un. ,,"$ 392,00",,392.00UD
Dia,perfumeria,ARG,SEDAL,Shampoo SEDAL Crema Balance 340 Ml. ,12%,"$ 469,00","$ 535,60",1379.41LT
Dia,perfumeria,ARG,FRUCTIS,Shampoo Garnier Fructis Goodbye Daños 350 Ml. ,2do 70%,"$ 606,59",,1733.11LT
Dia,perfumeria,ARG,PANTENE,Shampoo Pantene Pro V Essentials Bambú 400 Ml. ,2do 70%,"$ 830,65",,2076.63LT
Dia,perfumeria,ARG,SEDAL,Shampoo SEDAL Colágeno y Vit C 340 Ml. ,12%,"$ 469,00","$ 535,60",1379.41LT
Dia,perfumeria,ARG,SEDAL,Acondicionador SEDAL Restauración Instantánea 340 Ml. ,12%,"$ 469,00","$ 535,60",1379.41LT
Dia,perfumeria,ARG,SEDAL,Acondicionador SEDAL Colágeno y Vit C 340 Ml. ,12%,"$ 469,00","$ 535,60",1379.41LT
Dia,perfumeria,ARG,COLGATE,Crema Dental Colgate Natural Extracs con Carbón Activado y Menta 70 Gr. ,,"$ 470,90",,6727.14KG
Dia,perfumeria,ARG,COLGATE,Pasta Dental Colgate Total 12 Limpieza Completa Tubo Reciclable 90 Gr. ,,"$ 567,00",,6300.00KG
Dia,perfumeria,ARG,SEDAL,Acondicionador SEDAL Bomba Argán  340 Ml. ,12%,"$ 469,00","$ 535,60",1379.41LT
Dia,perfumeria,ARG,SEDAL,Shampoo SEDAL Jengibre Ricino 340 Ml. ,12%,"$ 469,00","$ 535,60",1379.41LT
Dia,perfumeria,ARG,TIO NACHO,Tío Nacho Shampoo Aclarante Recargable Doypack x 400 Ml. ,31%,"$ 559,00","$ 805,05",1397.50LT
Dia,perfumeria,ARG,TIO NACHO,Tío Nacho Acondicionador Aclarante Recargable Doypack x 400 Ml. ,31%,"$ 559,00","$ 805,05",1397.50LT
Dia,perfumeria,ARG,SEDAL,Acondicionador SEDAL Jengibre Ricino 340 Ml. ,12%,"$ 469,00","$ 535,60",1379.41LT
Dia,perfumeria,ARG,NIVEA,Desodorante antitranspirante femenino Nivea Black Pearl Spray 150 Ml. ,,"$ 485,10",,3234.00LT
Dia,perfumeria,ARG,BONTE,Protectores Diarios Bonté 40 Ud. ,,"$ 405,80",,10.15UD
Dia,perfumeria,ARG,BONTE,Jabón de Tocador Bonté Antibacterial 90 Gr. ,2x1,"$ 196,00",,2177.78KG
Dia,perfumeria,ARG,VENUS,Repuesto de Afeitar Venus Sensitive con Aloe 2 Un ,,"$ 942,10",,471.05UD
Dia,perfumeria,ARG,CURITAS,Apósitos adhesivos Curitas Frozen II para niños 20 Un. ,24%,"$ 409,00","$ 535,90",20.45UD
Dia,perfumeria,ARG,GILLETTE,Máquina de Afeitar Prestobarba Ultragrip2 5 Un ,,"$ 509,30",,101.86UD
Dia,perfumeria,ARG,PRO,Cepillo Dental Oral B Pro Cuidado Anticaries 1 Un. ,,"$ 272,70",,272.70UD
Dia,perfumeria,ARG,PALMOLIVE,Jabón Líquido para cuerpo Palmolive Jazmín Repuesto 200 Ml. ,,"$ 275,60",,1378.00LT
Dia,perfumeria,ARG,COLGATE,Crema Dental Colgate Triple Accion Xtra Whitening 70 Gr. ,,"$ 416,62",,5951.71KG
Dia,perfumeria,ARG,NIVEA,Desodorante antitranspirante Nivea Men Deep Original Spray 150 Ml. ,25%,"$ 419,71","$ 559,61",3730.73LT
Dia,perfumeria,ARG,NIVEA,Desodorante antitranspirante Nivea Men Sensitive Protect Roll On 50 Ml. ,,"$ 257,30",,1715.33LT
Dia,perfumeria,ARG,NIVEA,Desodorante antitranspirante femenino Nivea Fresh Spray Agua de Coco 150 Ml. ,25%,"$ 435,33","$ 580,44",3869.60LT
Dia,perfumeria,ARG,NIVEA,Desodorante antitranspirante Nivea Men Antibacterial Spray 150 Ml. ,25%,"$ 433,14","$ 577,52",3850.13LT
Dia,perfumeria,ARG,BONTE,Gel Post Solar Bonte Aloe Vera 200 Ml. ,15%,"$ 815,00","$ 958,00",4075.00LT
Dia,perfumeria,ARG,KOTEX,Protector Diario Kotex Esencial 20 Un. ,40%,"$ 290,00","$ 483,89",14.50UD
Dia,perfumeria,ARG,NIVEA,Desodorante antitranspirante Nivea Men Dry Fresh Spray 150 Ml. ,,"$ 523,20",,3488.00LT
Dia,perfumeria,ARG,FRUCTIS,Acondicionador Garnier Fructis Recarga Nutritiva Oil Repair 3 350 Ml. ,2do 70%,"$ 926,57",,2647.34LT
Dia,perfumeria,ARG,COLGATE,Cepillo Dental Colgate Extra Clean Mediano 1 Un. ,,"$ 143,30",,143.30UD
Dia,perfumeria,ARG,GILLETTE,Repuestos de Afeitar  Gillette Mach3+ Con Extra Lubricación 2 Un ,30%,"$ 810,02","$ 1.157,17",578.59UD
Dia,perfumeria,ARG,PLUSBELLE,Acondicionador Plusbelle Reconexión 1 Lt. ,,"$ 578,10",,578.10LT
Dia,perfumeria,ARG,NIVEA,Crema Corporal Nivea Manteca de Karité 5 en 1 para Piel Seca 250 ml. ,,"$ 805,50",,3222.00LT
Dia,perfumeria,ARG,ORAL B,Cepillos Dentales Oral-B Clean Indicator Medio 3 Un. ,34%,"$ 656,00","$ 986,98",218.67UD
Dia,perfumeria,ARG,KOTEX,Protector Diario Kotex Esencial 60 Un. ,34%,"$ 735,00","$ 1.110,75",12.25UD
Dia,perfumeria,ARG,NIVEA,Desodorante antitranspirante femenino Nivea Protect & Care Roll On 50 Ml. ,,"$ 257,30",,5146.00LT
Dia,perfumeria,ARG,BONTE,Maquinas de Afeitar Bonté 3Un. ,,"$ 221,10",,73.70UD
Dia,perfumeria,ARG,BONTE,Hisopos Bonté 100 Un. ,,"$ 340,00",,3.40UD
Dia,perfumeria,ARG,DOVE,Shampoo DOVE Ritual de Reparación Coco y Cúrcuma 200 Ml. ,,"$ 539,30",,2696.50LT
Dia,perfumeria,ARG,ALWAYS,Protectores Diarios Always Respirables 40 Un. ,2do 70%,"$ 965,15",,24.13UD
Dia,perfumeria,ARG,ALGABO,Alcohol en Gel Algabo 70 Ml. ,,"$ 123,50",,1764.29LT
Dia,perfumeria,ARG,SEDAL,Shampoo SEDAL Bomba Argán 340 Ml. ,12%,"$ 469,00","$ 535,60",1379.41LT
Dia,perfumeria,ARG,DOVE,Acondicionador DOVE Coco y Cúrcuma Coco y Cúrcuma 750 Ml. ,,"$ 1.409,10",,1878.80LT
Dia,perfumeria,ARG,TEATRICAL,Teatrical crema facial Humectante 100 Gr. ,18%,"$ 255,00","$ 311,41",2550.00KG
Dia,perfumeria,ARG,ALWAYS,Protectores diarios Always Respirable sin perfume 80 Un. ,2do 70%,"$ 1.687,55",,21.09UD
Dia,perfumeria,ARG,ALWAYS,Protectores Diarios Always Respirables 15 Un. ,2do 70%,"$ 419,51",,27.97UD
Dia,perfumeria,ARG,PLENITUD,Protector Esencial Plenitud Femme 20 Un. ,2x1,"$ 576,86",,28.84UD
Dia,perfumeria,ARG,DOVE,Acondicionador DOVE Coco y Cúrcuma Coco y Cúrcuma 200 Ml. ,,"$ 538,00",,2690.00LT
Dia,perfumeria,ARG,ASEPXIA,Jabón Asepxia Carbón Detox para Piel Mixta 100 Gr. ,30%,"$ 419,00","$ 595,85",4190.00KG
Dia,perfumeria,ARG,PANTENE,Shampoo y Acondicionador Pantene 2 en 1 Cuidado Clásico 400 Ml. ,,"$ 468,31",,1170.78LT
Dia,perfumeria,ARG,PLUSBELLE,Jabón de Tocador Plusbelle Humectación 3 x 120 Gr. ,,"$ 480,06",,4000.50KG
Dia,perfumeria,ARG,COLGATE,Cepillo de Dientes Colgate Baby 0-12 meses 1 Un. ,50%,"$ 865,00","$ 1.730,00",1730.00UD
Dia,perfumeria,ARG,REXONA,Desodorante Antitranspirante Rexona Extra Dry en aerosol 110 Ml. ,8%,"$ 645,00","$ 701,86",5863.64LT
Dia,perfumeria,ARG,NIVEA,Desodorante antitranspirante femenino Nivea Protect & Care Spray 150 Ml. ,25%,"$ 436,84","$ 582,45",3883.00LT
Dia,perfumeria,ARG,BONTE,Algodón Hidrofilo Super 140 Gr. ,,"$ 396,80",,2834.29KG
Dia,perfumeria,ARG,DOVE,Acondicionador DOVE Reconstrucción Completa Superior 400 Ml. ,,"$ 886,00",,1930.00LT
Dia,perfumeria,ARG,PALMOLIVE,Jabón de Tocador Palmolive Naturals Karite y Vit E 3x90 Gr. ,,"$ 388,17",,1437.67KG
Dia,perfumeria,ARG,COLGATE,Cepillo Dental Colgate zigzag Plus Suave 2 Ud. ,,"$ 297,60",,297.60UD
Dia,perfumeria,ARG,COLGATE,Pack Cepillo Dental Colgate Triple Acción Media 2 Ud. ,,"$ 283,90",,141.95UD
Dia,perfumeria,ARG,FRUCTIS,Shampoo Fructis Aguacate 300 Ml. ,5%,"$ 1.239,75","$ 1.305,00",3263.33LT
Dia,perfumeria,ARG,DOVE,Acondicionador Dove Ritual Detox Matcha 400 Ml. ,13%,"$ 772,00","$ 886,00",1930.00LT
Dia,perfumeria,ARG,NIVEA,Desodorante Antitranspirante Nivea Men Protect & Care 150 Ml. ,25%,"$ 449,26","$ 599,01",3993.40LT
Dia,perfumeria,ARG,DOVE,Desodorante Antitranspirante Dove Original 87 Gr. ,,"$ 551,55",,6339.66KG
Dia,perfumeria,ARG,ELVIVE,Acondicionador Keraliso 230° Elvive 400 Ml. ,2do 80%,"$ 1.045,95",,2614.88LT
Dia,perfumeria,ARG,H&S/HEAD&SHOULDER,Acondicionador Head & Shoulders Humectación 300 Ml. ,,"$ 855,80",,2852.67LT
Dia,perfumeria,ARG,BARBIE,Body Splash Barbie 95 Ml. ,7%,"$ 1.045,00","$ 1.125,86",1100.00LT
Dia,perfumeria,ARG,REXONA,Desodorante Antitranspirante Rexona Men Clinical 110 Ml. ,8%,"$ 645,00","$ 701,86",5863.64LT
Dia,perfumeria,ARG,H&S/HEAD&SHOULDER,Shampoo 3 en 1 Head & Shoulders 375 Ml. ,,"$ 971,61",,2590.96LT
Dia,perfumeria,ARG,FRUCTIS,Acondicionador Fructis Aguacate 300 Ml. ,5%,"$ 1.239,75","$ 1.305,00",3263.33LT
Dia,perfumeria,ARG,ELVIVE,Shampoo Keralisos 230° 400 Ml. ,2do 80%,"$ 1.045,95",,2614.88LT
Dia,perfumeria,ARG,DOVE,Desodorante Antitranspirante Dove Original 250 Ml. ,,"$ 769,75",,3079.00LT
Dia,perfumeria,ARG,CAREFREE,Protectores diarios CAREFREE® Todos los días Compact 80 Un. ,30%,"$ 605,00","$ 865,43",7.56UD
Dia,perfumeria,ARG,TRESEMME,Shampooo TRESEMME Cauterización Reparadora 500 Ml. ,,"$ 911,54",,1823.08LT
Dia,perfumeria,ARG,BONTE,Crema Dental Bonté Fluor 180 Gr. ,,"$ 442,10",,2456.11KG
Dia,perfumeria,ARG,TRESEMME,Acondicionador TRESEMME Cauterización Reparadora 500 Ml. ,,"$ 911,54",,1823.08LT
Dia,perfumeria,ARG,COLGATE,Cepillo Dental Colgate 360° Luminous White 2 Un. ,20%,"$ 665,60","$ 832,00",416.00UD
Dia,perfumeria,ARG,BONTE,Toallitas Femeninas Bonté Tanga 8 Ud. ,,"$ 227,90",,28.49UD
Dia,perfumeria,ARG,SUAVE,Jabón Líquido  SUAVE  Miel y Almendras  220 Ml. ,,"$ 152,60",,693.64LT
Dia,perfumeria,ARG,COLGATE,Cepillo Dental Colgate Triple Acción 3 Un. ,,"$ 463,63",,154.54UD
Dia,perfumeria,ARG,GILLETTE,Afeitadora Gillette Mach3+ Con Extra Lubricación 1 Un ,30%,"$ 810,02","$ 1.157,17",1157.17UD
Dia,perfumeria,ARG,NIVEA,Crema Corporal Nivea Aloe Vera 5 en 1 para Piel Normal a Seca 250 ml. ,,"$ 622,30",,2489.20LT
Dia,perfumeria,ARG,NIVEA,Crema facial 5 en 1 NIVEA Cuidado Nutritivo para todo tipo de piel 100 Ml. ,20%,"$ 575,00","$ 718,49",5750.00LT
Dia,perfumeria,ARG,PANTENE,Acondicionador Pantene Cuidado Clásico 400 Ml. ,,"$ 468,31",,1170.78LT
Dia,perfumeria,ARG,PLUSBELLE,Jabón de Tocador Plusbelle Radiante 3x120 Gr. ,,"$ 472,70",,3939.17KG
Dia,perfumeria,ARG,REXONA,Desodorante Antitranspirante Rexona Cotton Dry 150 Ml. ,,"$ 499,00",,3326.67LT
Dia,perfumeria,ARG,H&S/HEAD&SHOULDER,Shampoo Manzana Fresh Head & Shoulders 375 Ml. ,,"$ 1.026,21",,2736.56LT
Dia,perfumeria,ARG,NIVEA,Jabón Coconut Milk NIVEA para todo tipo de piel 3 un 125 Gr. ,,"$ 542,72",,723.63KG
Dia,perfumeria,ARG,NIVEA,Desodorante antitranspirante Nivea Men Sensitive Protect Spray 150 Ml. ,,"$ 523,20",,3488.00LT
Dia,perfumeria,ARG,FRUCTIS,Shampoo Garnier Fructis Oil Repair 3 350 Ml. ,2do 70%,"$ 965,82",,2759.49LT
Dia,perfumeria,ARG,DOVE,Acondicionador DOVE Ritual de Crecimiento Equinacea 400 Ml. ,,"$ 886,00",,1930.00LT
Dia,perfumeria,ARG,COLGATE,Pasta Dental Colgate Triple Acción Tubo Reciclable 140 Gr. ,,"$ 628,80",,4491.43KG
Dia,perfumeria,ARG,FRUCTIS,Acondicionador Garnier Fructis Oil Repair 350 Ml. ,2do 70%,"$ 965,82",,2759.49LT
Dia,perfumeria,ARG,LUX,Jabón Líquido Luz Jazmín Doypack 220 Ml ,,"$ 314,10",,1427.73LT
Dia,perfumeria,ARG,BONTE,Enjuague Bucal Bonté Everyday 250 Ml. ,,"$ 489,70",,1958.80LT
Dia,perfumeria,ARG,H&S/HEAD&SHOULDER,Shampoo Head & Shoulders Fuerza Raíz 180 Ml. ,,"$ 611,10",,3395.00LT
Dia,perfumeria,ARG,PLUSBELLE,Jabón de Tocador Plusbelle Nutrición Vita Glicerina 3 x 120 Gr. ,,"$ 487,83",,4065.25KG
Dia,perfumeria,ARG,ELVIVE,Tratamiento Capilar Reparador L'Oréal 300 Gr. ,30%,"$ 796,03","$ 1.137,18",3790.60LT
Dia,perfumeria,ARG,REXONA,Desodorante Antitranspirante Rexona Invisible en Aerosol 150 Ml. ,,"$ 499,00",,3326.67LT
Dia,perfumeria,ARG,SIEMPRE LIBRE,Toallas Femeninas Siempre Libre Especial x 8 Un. ,31%,"$ 180,00","$ 259,56",22.50UD
Dia,perfumeria,ARG,DOVE,Shampoo DOVE Regeneración Extrema Superior 400 Ml. ,,"$ 886,00",,1930.00LT
Dia,perfumeria,ARG,H&S/HEAD&SHOULDER,Acondicionador Head & Shoulders Suave y Manejable 150 Ml. ,,"$ 528,60",,3524.00LT
Dia,perfumeria,ARG,GILLETTE,Gillette Prestobarba3 Sensitive Máquina de Afeitar Desechable para Piel Sensible 4 Unidades ,,"$ 1.387,90",,346.98UD
Dia,perfumeria,ARG,BONTE,Shampoo Bonté Reparación Extrema 10 Ml. ,,"$ 34,00",,3400.00LT
Dia,perfumeria,ARG,H&S/HEAD&SHOULDER,Shampoo Protección Caída Head & Shoulders 375 Ml. ,,"$ 1.045,95",,2789.20LT
Dia,perfumeria,ARG,PLAX,Enjuague Bucal Colgate Plax Soft Mint 250 Ml. ,,"$ 348,39",,1393.56LT
Dia,perfumeria,ARG,H&S/HEAD&SHOULDER,Shampoo Humectación Head & Shoulders 375 Ml. ,,"$ 1.026,21",,2736.56LT
Dia,perfumeria,ARG,BONTE,Acondicionador Bonté Reparación Extrema 10 Ml. ,,"$ 34,00",,3400.00LT
Dia,perfumeria,ARG,BONTE,Coloración en Crema Bonté Negro Intenso 1.0 160 Gr. ,,"$ 645,00",,645.00UD
Dia,perfumeria,ARG,BONTE,Coloración en Crema Castaño Oscuro 3.0 160 Gr. ,,"$ 645,00",,645.00UD
Dia,perfumeria,ARG,NIVEA,Crema Facial Nivea Cuidado Sensitive 100 Ml. ,24%,"$ 259,00","$ 342,99",2590.00LT
Dia,perfumeria,ARG,REXONA,Desodorante Antitranspirante en crema REXONA Odorono con Glicerina 60 Gr. ,,"$ 282,85",,4714.17KG
Dia,perfumeria,ARG,BONTE,Coloración en Crema Bonté Chocolate 3.31 160 Gr. ,,"$ 645,00",,645.00UD
Dia,perfumeria,ARG,H&S/HEAD&SHOULDER,Shampoo Head & Shoulders Fuerza Raíz 375 Ml. ,,"$ 934,00",,2490.67LT
Dia,perfumeria,ARG,BONTE,Coloración en Crema Bonté Platino 10.1 160 Gr. ,,"$ 645,00",,645.00UD
Dia,perfumeria,ARG,KOTEX,Protector Diario Kotex Antibacterial 60 Un. ,,"$ 782,15",,13.04UD
Dia,perfumeria,ARG,COLGATE,Enjuague Bucal Colgate Plax Fresh Mint 500 Ml. ,,"$ 720,42",,1440.84LT
Dia,perfumeria,ARG,NIVEA,Protector Solar Nivea Niños FPS 70 200 Ml. ,,"$ 1.970,29",,9851.45LT
Dia,perfumeria,ARG,TRESEMME,Shampoo TRESEMME Ondas Boho 500 Ml. ,,"$ 883,28",,1766.56LT
Dia,perfumeria,ARG,REXONA,Desodorante Antitranspirante Rexona Mujer Active Emotion en Aerosol 150 Ml. ,,"$ 499,00",,3326.67LT
Dia,perfumeria,ARG,COLGATE,Pasta Dental Colgate Sensitive Pro-Alivio 110 Gr. ,,"$ 889,48",,8086.18KG
Dia,perfumeria,ARG,ALGABO,Espuma Para Afeitar Algabo Men 200 Ml. ,,"$ 503,75",,2518.75LT
Dia,perfumeria,ARG,COLGATE,Crema Dental Colgate Herbal Blanqueadora 90 Gr. ,,"$ 353,64",,3929.33KG
Dia,perfumeria,ARG,H&S/HEAD&SHOULDER,Shampoo Head & Shoulders Suave Manejable 180 Ml. ,,"$ 625,77",,3476.50LT
Dia,perfumeria,ARG,TRESEMME,Acondicionador TRESEMME Ondas Boho 500 Ml. ,,"$ 883,28",,1766.56LT
Dia,perfumeria,ARG,H&S/HEAD&SHOULDER,Shampoo Carbón Activado Head & Shoulders 180 Ml. ,,"$ 600,11",,3333.94LT
Dia,perfumeria,ARG,CURITAS,Curinas Matias 6 Un. ,,"$ 107,20",,17.87UD
Dia,perfumeria,ARG,HIND'S,Desodortante Hinds Roll-On Intra Soft 60 Gr. ,,"$ 296,91",,4948.50KG
Dia,perfumeria,ARG,H&S/HEAD&SHOULDER,Shampoo Head & Shoulders Hidratación Coco 375 Ml. ,,"$ 1.026,21",,2736.56LT
Dia,perfumeria,ARG,LINA,Toallita Femenina Lina Anatómicas con Alas 16 Un. ,,"$ 350,00",,21.88UD
Dia,perfumeria,ARG,DOVE,Acondicionador Regeneración Extrema Dove 400 Ml. ,,"$ 935,00",,1930.00LT
Dia,perfumeria,ARG,SEDAL,Shampoo SEDAL Ceramidas Doypack 300 Ml. ,,"$ 473,69",,1578.97LT
Dia,perfumeria,ARG,REXONA,Desodorante Antitranspirante Rexona Mujer Nutritive en Aerosol 150 Ml. ,,"$ 499,00",,3326.67LT
Dia,perfumeria,ARG,DOVE,Shampoo Hidratación Intensa Dove 400 Ml. ,,"$ 935,00",,1930.00LT
Dia,perfumeria,ARG,SEDAL,Acondicionador SEDAL Ceramidas Doypack 300 Ml. ,,"$ 473,69",,1578.97LT
Dia,perfumeria,ARG,CRINFIL,Quitaesmalte hipoalergénico libre de acetona Crinfil 50 Ml. ,,"$ 152,60",,3052.00LT
Dia,perfumeria,ARG,TRESEMME,Protector Térmico Tresemme Spray 120 Ml. ,,"$ 1.181,54",,9846.17LT
Dia,perfumeria,ARG,IMPULSE,Desodorante Impulse Very Pink 150 Ml. ,,"$ 404,54",,2696.93LT
Dia,perfumeria,ARG,ESPADOL,Jabón barra exfoliante Espadol 80 Gr. ,,"$ 218,80",,2735.00KG
Dia,perfumeria,ARG,LIFE QUALITY,Jabón líquido antibacterial original Life Quality 250 Ml. ,,"$ 359,70",,1438.80LT
Dia,perfumeria,ARG,ALGABO,Jabón Líquido Algabo Messi 300 Ml. ,,"$ 1.954,49",,6514.97LT
Dia,perfumeria,ARG,H&S/HEAD&SHOULDER,Shampoo Argán Head & Shoulders 180 Ml. ,,"$ 969,05",,5383.61LT
Dia,perfumeria,ARG,SEDAL,Acondicionador SEDAL Crema Balance 650 Ml. ,,"$ 938,09",,1443.22LT
Dia,perfumeria,ARG,SEDAL,Acondicionador SEDAL Hialurónico y Vit A 650 Ml. ,,"$ 938,09",,1443.22LT
Dia,perfumeria,ARG,SEDAL,Shampoo SEDAL Crema Balance 650 Ml. ,,"$ 938,09",,1443.22LT
Dia,perfumeria,ARG,EVAGINA,Jabón Líquido Íntimo Evagina 200 Ml. ,,"$ 1.338,32",,6691.60LT
Dia,perfumeria,ARG,DOVE,Jabón en barra Dove Antibacterial Cuida & Protege 90 Gr. ,,"$ 256,25",,2847.22KG
Dia,perfumeria,ARG,ELVIVE,Acondicionador Elvive Oleo Nutritivo 400 Ml. ,,"$ 1.543,15",,3857.88LT
Dia,perfumeria,ARG,SEDAL,Acondicionador SEDAL Ceramidas 650 Ml. ,,"$ 938,09",,1443.22LT
Dia,perfumeria,ARG,LIFE QUALITY,Jabón líquido antibacterial skin care Life Quality 250 Ml. ,,"$ 359,70",,1438.80LT
Dia,perfumeria,ARG,HIND'S,Desodorante Antitraspirante Hinds Rosa Roll On 60 Gr. ,,"$ 293,84",,4897.33KG
Dia,perfumeria,ARG,DOVE,Shampoo DOVE Óleo Nutrición Superior 400 Ml. ,,"$ 886,00",,1930.00LT
Dia,perfumeria,ARG,TIO NACHO,Shampoo Tio Nacho Aclarante Reciclable 200 Ml. ,,"$ 702,99",,3514.95LT
Dia,perfumeria,ARG,SEDAL,Acondicionador SEDAL Hialurónico y Vit A 190 Ml. ,,"$ 407,64",,1198.94LT
Dia,perfumeria,ARG,ELVIVE,Shampoo Elvive Oleo Nutritivo 400 Ml. ,,"$ 1.543,15",,3857.88LT
Dia,perfumeria,ARG,SEDAL,Acondicionador SEDAL Restauración Instantánea 650 Ml. ,,"$ 938,09",,1443.22LT
Dia,perfumeria,ARG,SEDAL,Shampoo SEDAL Ceramidas 190 Ml. ,,"$ 407,64",,2145.47LT
Dia,perfumeria,ARG,COLGATE,Crema Dental Total 12 Whitening Colgate 90 Gr. ,,"$ 810,26",,9002.89KG
Dia,perfumeria,ARG,BONTE,Protector Solar DIA Spf 45 130 Ml. ,,"$ 1.969,00",,15146.15LT
Dia,perfumeria,ARG,DOVE,Shampoo DOVE Reconstrucción Completa Superior 180 Ml. ,,"$ 407,86",,2265.89LT
Dia,perfumeria,ARG,REXONA,Jabón de Glicerina Rexona Neutro dermatológicamente testeado 3x90 Gr. ,,"$ 636,86",,2358.74KG
Dia,perfumeria,ARG,SEDAL,Shampoo SEDAL Hialurónico y Vit A 650 Ml. ,,"$ 938,09",,1443.22LT
Dia,perfumeria,ARG,SEDAL,Acondicionador SEDAL Ceramidas 190 Ml. ,,"$ 407,64",,2145.47LT
Dia,perfumeria,ARG,SEDAL,Shampoo SEDAL Crema Balance 190 Ml. ,,"$ 407,64",,2145.47LT
Dia,perfumeria,ARG,SEDAL,Acondicionador SEDAL Crema Balance 190 Ml. ,,"$ 407,64",,2145.47LT
Dia,perfumeria,ARG,SEDAL,Shampoo SEDAL Restauración Instantánea 650 Ml. ,,"$ 938,09",,1443.22LT
Dia,perfumeria,ARG,ELVIVE,Crema para Peinar Elvive Dream Long 250 Ml. ,,"$ 842,06",,3368.24LT
Dia,perfumeria,ARG,EVAGINA,Gel Íntimo Pomo Evagina 50 Ml. ,,"$ 1.428,96",,28579.20LT
Dia,perfumeria,ARG,DOVE,Acondicionador DOVE Hidratación Intensa 400 Ml. ,,"$ 886,00",,1930.00LT
Dia,perfumeria,ARG,EVACOPA,Evacopa Talle 1 x Unidad ,,"$ 3.500,15",,3500.15UD
Dia,perfumeria,ARG,SEDAL,Shampoo SEDAL Hialurónico y Vit A 190 Ml. ,,"$ 473,69",,2493.11LT
Dia,perfumeria,ARG,BIC,Máquina de Afeitar Bic Flex3 3 Hojas 2 Un. ,,"$ 584,84",,292.42UD
Dia,perfumeria,ARG,EVACOPA,Evacopa Talle 2 x Unidad ,,"$ 3.500,15",,3500.15UD
Dia,perfumeria,ARG,GUM,Hilo Dental Gum Con Mango-Flosser 1 Un. ,,"$ 428,13",,21.41UD
Dia,perfumeria,ARG,COLGATE,Cepillo Dental Colgate Bamboo 1 Un. ,,"$ 740,71",,740.71UD
Dia,perfumeria,ARG,KOLYNOS,Cepillo de Dientes Kolynos Doctor Suave 2 Un. ,,"$ 336,46",,168.23UD
Dia,perfumeria,ARG,47 STREET,Body Splach Blueberry 47 Street 150 Ml. ,,"$ 1.531,34",,16119.37LT
Dia,perfumeria,ARG,COLGATE,Cepillo Dental Colgate Extra Clean Firme Doble Acción 2 Un. ,,"$ 339,00",,169.50UD
Dia,perfumeria,ARG,EVACOPA,Evacopa Talle 3 x Unidad ,,"$ 3.500,15",,3500.15UD
Dia,perfumeria,ARG,BARBIE,Perfume Barbie 50 Ml. ,,"$ 2.261,67",,45233.40LT
Dia,perfumeria,ARG,DOVE,Shampoo DOVE Óleo Nutrición Superior 200 Ml. ,,"$ 606,15",,3030.75LT
Dia,perfumeria,ARG,VEET,Crema Facial Veet 30 Ml. ,,"$ 687,25",,22908.33LT
Dia,perfumeria,ARG,ORAL B,Cepillo Dental Oral B Indicator 2 Un. ,,"$ 758,20",,379.10UD
Dia,perfumeria,ARG,NEW MASK,Barbijo New Mask  Tricapa Termisellados 5 Un. ,,"$ 220,99",,44.20UD
Dia,perfumeria,ARG,PANTENE,Acondicionador Pantene Pro V Liso Extremo 400 Ml. ,,"$ 912,97",,2282.43LT
Dia,perfumeria,ARG,PANTENE,Sellador Pantene Puntas Colágeno 90 Ml. ,,"$ 926,02",,10289.11LT
Dia,perfumeria,ARG,NIVEA,Protector Labial Nivea Soft Rosé 1 Un. ,,"$ 512,15",,512.15UD
Dia,perfumeria,ARG,REXONA,Desodorante Antitranspirante Rexona Women Fútbal Fanáticas en aerosol 150 Ml. ,,"$ 499,00",,3326.67LT
Dia,perfumeria,ARG,KOTEX,Tampones Kotex Súper 12 Un. ,,"$ 558,34",,46.53UD
Dia,perfumeria,ARG,CAREFREE,Protectores diarios CAREFREE® Todos los Días Tanga x 60 Un. ,,"$ 1.308,05",,21.80UD
Dia,perfumeria,ARG,PLENITUD,Protector Plenitud Leve Antibacterial 14 Un. ,,"$ 361,17",,25.80UD
Dia,perfumeria,ARG,ALGABO,Jabón Líquido Algabo Antibacterial para Manos 300 Ml. ,,"$ 483,21",,1610.70LT
Dia,perfumeria,ARG,NIVEA,Crema corporal reafirmante Nivea Q10 con Colágeno todo tipo de piel 400 Ml. ,,"$ 1.396,50",,3491.25LT
Dia,perfumeria,ARG,REXONA,Jabón de Glicerina Rexona Neutro dermatológicamente testeado 90 Gr. ,,"$ 235,48",,2616.44KG
Dia,perfumeria,ARG,REXONA,Desodorante Antitranspirante Rexona Hombre en Aerosol 150 Ml. ,,"$ 551,45",,3676.33LT
Dia,perfumeria,ARG,NOSOTRAS,Toallita Femenina Nosotras Buenas Noches tela algodón 8 Un. ,,"$ 411,88",,51.49UD
Dia,perfumeria,ARG,KOTEX,Tampones Kotex Medio 12 Un. ,,"$ 558,34",,46.53UD
Dia,perfumeria,ARG,NOSOTRAS,Toallita Femenina Nosotras Clásica tela tipo algodón 16 Un. ,,"$ 411,88",,25.74UD
Dia,perfumeria,ARG,AXE,Desodorante Axe Dark Temptation en Aerosol 150 Ml. ,,"$ 424,95",,2833.00LT
Dia,perfumeria,ARG,NOSOTRAS,Protector diario Nosotras Normal con aloe x 60 ,,"$ 518,96",,
Dia,perfumeria,ARG,ODOL,Crema Dental Odol Doble Protección 180 Gr. ,,"$ 303,43",,1685.72KG
Dia,perfumeria,ARG,PANTENE,Acondicionador Pantene Essentials Bambú 400 Ml. ,,"$ 830,65",,2076.63LT
Dia,perfumeria,ARG,COLGATE,Cepillo de dientes Colgate Colors Collection 5 Un. ,,"$ 1.017,14",,1017.14UD
Dia,perfumeria,ARG,O.B.,Tampones Ob Siempre Libre Super x 16 Un. ,,"$ 769,45",,48.09UD
Dia,perfumeria,ARG,SEDAL,Crema para Peinar SEDAL Ácido Hialurónico + Vitamina A 300 Ml. ,,"$ 549,83",,1832.77LT
Dia,perfumeria,ARG,REXONA,Jabón Tocador Rexona Active Tripack 375 Gr. ,,"$ 536,76",,1431.36KG
Dia,perfumeria,ARG,REXONA,Desodorante Antitranspirante Rexona Original 250 Ml. ,,"$ 774,73",,2636.00LT
Dia,perfumeria,ARG,DOVE,Shampoo DOVE Ritual de Reparación Coco y Cúrcuma 400 Ml. ,,"$ 886,00",,1930.00LT
Dia,perfumeria,ARG,REXONA,Jabón Tocador Rexona Sensible Fresh Tripack 375 Gr. ,,"$ 536,76",,1431.36KG
Dia,perfumeria,ARG,PANTENE,Acondicionador Pantene Pro V Brillo Extremo 400 Ml. ,,"$ 884,66",,2211.65LT
Dia,perfumeria,ARG,LISTERINE,Enjuague Bucal LISTERINE® FRESHBURST Frescura Intensa 500 Ml. ,,"$ 1.066,58",,2133.16LT
Dia,perfumeria,ARG,SEDAL,Shampoo Sedal Ceramidas 650 Ml. ,,"$ 867,43",,1334.51LT
Dia,perfumeria,ARG,AXE,Desodorante Antitranspirante AXE Dark Temptation 152 Ml. ,,"$ 424,95",,2795.72LT
Dia,perfumeria,ARG,SEDAL,Shampoo Sedal Ceramidas 340 Ml. ,,"$ 498,74",,1466.88LT
Dia,perfumeria,ARG,SEDAL,Acondicionador Sedal Crema Balance Hidratante 340 Ml. ,,"$ 498,74",,1466.88LT
Dia,perfumeria,ARG,SEDAL,Acondicionador Sedal Ceramidas 340 Ml. ,,"$ 498,74",,1466.88LT
Dia,perfumeria,ARG,SEDAL,Acondicionador Sedal Hidratante con Ceramidas 650 Ml. ,,"$ 867,43",,1334.51LT
Dia,perfumeria,ARG,DOVE,Shampoo DOVE Hidratación Intensa 400 Ml. ,,"$ 886,00",,1930.00LT
Dia,perfumeria,ARG,GILLETTE,Máquina de Afeitar Gillette Para Piel Sensible Derma Protección 2 Un ,,"$ 797,82",,398.91UD
Dia,perfumeria,ARG,LUX,Jabón en Barra Lux Jazmín 3x125 Gr. ,,"$ 599,42",,1598.45KG
