market,category,currency,marca,descripcion,promocion,precio_producto,precio_promocion,precio_kilo
Dia,desayuno,ARG,DIA,Galletitas Dulces DIA Vainilla con Frutos del Bosque 140 Gr. ,,"$ 187,00",,1335.71KG
Dia,desayuno,ARG,NESCAFE,Cápsulas Nestlé Dolce Gusto Café con Leche 160 Gr. ,,"$ 1.875,78",,11723.63KG
Dia,desayuno,ARG,AMANDA,Yerba Mate Amanda Tradicional 1 Kg. ,,"$ 770,80",,770.80KG
Dia,desayuno,ARG,LA CAMPAGNOLA,Mermelada BC Durazno 390 Gr. ,,"$ 427,00",,1094.87KG
Dia,desayuno,ARG,DIA,Tostadas de Arroz DIA 150 Gr. ,,"$ 214,76",,1431.73KG
Dia,desayuno,ARG,LINCOLN,Galletitas Dulces Lincoln de Terrabusi 153 Gr. ,,"$ 106,50",,696.08KG
Dia,desayuno,ARG,DIA,Galletas de Arroz DIA con Sal 100 Gr. ,,"$ 124,46",,1244.60KG
Dia,desayuno,ARG,NESQUIK,Cacao en Polvo Nesquik Mix menos azúcares 360 Gr. ,,"$ 709,87",,1971.86KG
Dia,desayuno,ARG,CBSE,Yerba Mate Cbse Naranja 500 Gr. ,20%,"$ 399,00","$ 499,00",798.00KG
Dia,desayuno,ARG,CBSE,Yerba Mate Cbse Hierbas Serranas 500 Gr. ,20%,"$ 399,00","$ 499,00",798.00KG
Dia,desayuno,ARG,DIA,Galletita Chocodias de Chocolate 230 Gr. ,,"$ 204,00",,886.96KG
Dia,desayuno,ARG,ARCOR,Mermelada Light Arcor Durazno 390 Gr. ,2do 50%,"$ 494,84",,1268.82KG
Dia,desayuno,ARG,VERONICA,Dulce de Leche Verónica Clásico 400 Gr. ,,"$ 200,20",,500.50KG
Dia,desayuno,ARG,DIA,Edulcorante Líquido DIA Stevia 500 Gr. ,,"$ 439,29",,878.58LT
Dia,desayuno,ARG,NESCAFE,Nescafé Dolca Suave Ideal para Batir Doypack 170 Gr. ,25%,"$ 974,43","$ 1.299,24",7642.59KG
Dia,desayuno,ARG,CASANTO,Manteca Casanto Paquete 200 Gr. ,,"$ 401,60",,2008.00KG
Dia,desayuno,ARG,9 DE ORO,Bizcochos 9 de Oro Azucarados 120 Gr. ,,"$ 193,50",,921.43KG
Dia,desayuno,ARG,DIA,Galletitas DIA Surtidas 360 Gr. ,,"$ 280,00",,777.78KG
Dia,desayuno,ARG,LA VIRGINIA,Café Molido La Virginia Equilibrado 1 Kg. ,,"$ 2.142,50",,2142.50KG
Dia,desayuno,ARG,DIA,Dulce de Leche Repostero DIA 400 Gr. ,,"$ 286,25",,715.63KG
Dia,desayuno,ARG,CHOCOLINAS,Galletitas Chocolinas 100 Gr. ,,"$ 97,94",,979.40KG
Dia,desayuno,ARG,DIA,Galletitas Pepas DIA 500 Gr. ,,"$ 329,00",,658.00KG
Dia,desayuno,ARG,DIA,Galletas de arroz DIA Dulces 100 Gr. ,,"$ 137,05",,1370.50KG
Dia,desayuno,ARG,LA SERENISIMA,Dulce de Leche La Serenisima Colonial 400 Gr. ,,"$ 507,30",,1268.25KG
Dia,desayuno,ARG,PEPITOS,Galletitas Pepitos Tripack 357 Gr. ,,"$ 660,40",,1849.86KG
Dia,desayuno,ARG,CEREALITAS,Galletitas Cerealitas Clásicas 207 Gr. ,,"$ 214,60",,893.72KG
Dia,desayuno,ARG,DIA,Mate Cocido DIA en saquitos 50 Ud. ,,"$ 202,90",,4.06UD
Dia,desayuno,ARG,ARCOR,Mermelada Arcor Light Ciruela 390 Gr. ,2do 50%,"$ 494,84",,1268.82KG
Dia,desayuno,ARG,TRAVIATA,Galletitas de agua Traviata 506 Gr. ,,"$ 471,20",,931.23KG
Dia,desayuno,ARG,NESQUIK,Cacao en Polvo Nesquik Extra Cacao menos azúcares 300 Gr. ,,"$ 740,99",,2469.97KG
Dia,desayuno,ARG,LA SERENISIMA,Dulce de Leche Clasico La Serenísima 400 Gr. ,,"$ 424,65",,1061.63KG
Dia,desayuno,ARG,MOLINOS ALA,Tostadas de Arroz Molinos Ala Clásicas 150 Gr. ,,"$ 288,65",,1924.33KG
Dia,desayuno,ARG,DIA,Galletitas DIA Vainilla rellenas con Chocolate 140 Gr. ,,"$ 187,00",,1335.71KG
Dia,desayuno,ARG,DIA,Galletitas Lunitas DIA Bañadas 200 Gr. ,,"$ 161,00",,805.00KG
Dia,desayuno,ARG,DIA,Té Verde DIA Sin TACC 25 Un. ,,"$ 123,25",,4.93UD
Dia,desayuno,ARG,CHOCOLINAS,Galletitas Chocolinas Chocolate 262 Gr. ,,"$ 339,30",,1295.04KG
Dia,desayuno,ARG,HOJALMAR,GALLETITA HOJALDRE TRIANGULO HOJALMAR X 250GR ,20%,"$ 279,00","$ 346,65",1116.00KG
Dia,desayuno,ARG,LA SERENISIMA,Dulce de Leche La Serenísima Clásico 250 Gr. ,,"$ 295,90",,1183.60KG
Dia,desayuno,ARG,CEREALITAS,Galletitas Cerealitas Clásicas 621 Gr. ,,"$ 571,55",,920.37KG
Dia,desayuno,ARG,DON SATUR,Bizcocho Don Satur Salado 200 Gr. ,,"$ 187,10",,935.50KG
Dia,desayuno,ARG,DIA,Galletitas DIA Chocolate y Vainilla 160 Gr ,,"$ 161,00",,1006.25KG
Dia,desayuno,ARG,CABRALES,Café Molido Cabrales Al Grano 500 Gr. ,,"$ 1.076,90",,2153.80KG
Dia,desayuno,ARG,NOBLEZA GAUCHA,Yerba Mate Nobleza Gaucha sin tacc 1 Kg. ,,"$ 639,84",,639.84KG
Dia,desayuno,ARG,LA MORENITA,Té en Saquitos Morenita 100 Un. ,,"$ 406,20",,4.06UD
Dia,desayuno,ARG,LEDESMA,Azúcar Ledesma Light 500 Gr. ,24%,"$ 199,00","$ 263,34",398.00KG
Dia,desayuno,ARG,DIA,Galletitas Dulces DIA Frutilla 140 Gr. ,,"$ 187,00",,1335.71KG
Dia,desayuno,ARG,HOJALMAR,Galletitas Dulces Hojalmar Larguitas de Hojaldre 250 Gr. ,20%,"$ 279,00","$ 346,65",1116.00KG
Dia,desayuno,ARG,TERRABUSI,Galletas Terrabusi Express Clásicas 303 Gr. ,,"$ 275,50",,909.24KG
Dia,desayuno,ARG,HILERET 1A10,Edulcorante Hileret Stevia 200 Ml. ,2do 50%,"$ 724,25",,3621.25LT
Dia,desayuno,ARG,DIA,Galletitas Mini Crackers DIA 5 Semillas 300 Gr. ,,"$ 209,00",,696.67KG
Dia,desayuno,ARG,DIA,Yerba Mate Dia con Palo 500 Gr. ,,"$ 377,38",,754.76KG
Dia,desayuno,ARG,DIA,Galletitas DIA Avena y Chips de Chocolate 186 Gr. ,,"$ 259,00",,1392.47KG
Dia,desayuno,ARG,BONAFIDE,Café en saquitos Bonafide 24 Ud. ,,"$ 486,80",,24.34UD
Dia,desayuno,ARG,HILERET 1A10,Edulcorante Stevia Hileret Forte 100 Un. ,2do 50%,"$ 778,60",,7.79UD
Dia,desayuno,ARG,PEPITOS,Galletitas Pepitos 119 Gr. ,,"$ 261,79",,2199.92KG
Dia,desayuno,ARG,MORIXE,Mini Crackers Morixe 5 Semillas 250 Gr. ,,"$ 222,30",,889.20KG
Dia,desayuno,ARG,DIA,Obleas DIA Chocolate 200 Gr. ,,"$ 231,30",,1156.50KG
Dia,desayuno,ARG,NESCAO,Polvo Chocolatado Nescao 150 Gr. ,,"$ 178,80",,1192.00KG
Dia,desayuno,ARG,MORIXE,AVENA INSTANTANEA MORIXE 600GR ,,"$ 475,29",,792.15KG
Dia,desayuno,ARG,CBSE,Yerba Mate Cbse Guaraná 500 Gr. ,20%,"$ 399,00","$ 499,00",798.00KG
Dia,desayuno,ARG,LA VIRGINIA,Té Común La Virginia saquitos 50 Un. ,,"$ 207,05",,4.14UD
Dia,desayuno,ARG,DON SATUR,Bizcocho Don Satur Dulce 200 Gr. ,,"$ 187,10",,935.50KG
Dia,desayuno,ARG,SMAMS,Galletitas Smams con Chips de Chocolate 150 Gr. ,,"$ 404,23",,2694.87KG
Dia,desayuno,ARG,MORIXE,Mini Cracker Sandwich Morixe 250 Gr. ,,"$ 197,80",,791.20KG
Dia,desayuno,ARG,OKEBON,Galletitas Okebon de Leche 273 Gr. ,,"$ 205,99",,754.54KG
Dia,desayuno,ARG,DIA,Obleas DIA Clásicas 200 Gr. ,,"$ 231,30",,1156.50KG
Dia,desayuno,ARG,DIA,Galletitas Palmeritas DIA 150 Gr. ,,"$ 209,70",,1398.00KG
Dia,desayuno,ARG,SONRISAS,Galletitas Sonrisas Frambuesa 3 Un. 324 Gr. ,,"$ 339,22",,1046.98KG
Dia,desayuno,ARG,DIA,Galletitas DIA con Chips de Chocolate 172 Gr. ,,"$ 218,06",,1267.79KG
Dia,desayuno,ARG,MANI KING,Pasta de Maní King Natural 485 Gr. ,,"$ 561,36",,1157.44KG
Dia,desayuno,ARG,LA VIRGINIA,Cápsulas La Virginia Capuccino 104 Gr. 8 Un. ,18%,"$ 999,00","$ 1.220,00",9605.77KG
Dia,desayuno,ARG,CBSE,Yerba Mate Cbse Jengibre 500 Gr. ,20%,"$ 399,00","$ 499,00",798.00KG
Dia,desayuno,ARG,DOLCE GUSTO,Cápsulas Capuccino Dolce Gusto 16 Un. 112 Gr. ,,"$ 1.875,78",,9977.55KG
Dia,desayuno,ARG,DIA,Galletitas Pepas DIA 250 Gr. ,,"$ 191,64",,766.56KG
Dia,desayuno,ARG,TODDY,Cacao en Polvo Toddy Extremo 180 gr ,15%,"$ 179,00","$ 209,71",994.44KG
Dia,desayuno,ARG,DIA,Yerba Especial Dia Sin TACC 500 Gr. ,,"$ 466,04",,932.08KG
Dia,desayuno,ARG,CHOCOLINO,Cacao Chocolino 800 Gr. ,,"$ 915,20",,1144.00KG
Dia,desayuno,ARG,NESCAFE,Nescafé Dolca Suave Ideal para Batir 170 Gr. ,25%,"$ 1.165,24","$ 1.553,66",9139.18KG
Dia,desayuno,ARG,DOLCA,Nescafé Dolca Suave Perfecto para batir 170 Gr. ,25%,"$ 974,43","$ 1.299,24",7642.59KG
Dia,desayuno,ARG,CBSE,Yerba Mate Cbse Silueta 500 Gr. ,20%,"$ 399,00","$ 499,00",798.00KG
Dia,desayuno,ARG,LA SERENISIMA,Dulce de Leche Repostero La Serenisima 400 Gr. ,25%,"$ 386,00","$ 515,45",965.00KG
Dia,desayuno,ARG,LA MORENITA,Café en Cápsula La Morenita Colombia 52 Gr. ,11%,"$ 1.149,00","$ 1.286,34",22096.15KG
Dia,desayuno,ARG,DOLCA,Café Instantáneo Nescafé Dolca Cortado 125 Gr. ,15%,"$ 349,00","$ 411,50",2792.00KG
Dia,desayuno,ARG,HILERET 1A10,Edulctorante Hileret Stevia 50 Un. ,2do 50%,"$ 539,45",,10.79UD
Dia,desayuno,ARG,DIA,Galletitas Dulces DIA Marmoladas 500 Gr. ,,"$ 357,10",,714.20KG
Dia,desayuno,ARG,NESQUIK,Cacao en Polvo Nesquik Nuevo 60 años 800 Gr. ,,"$ 1.407,58",,1759.48KG
Dia,desayuno,ARG,SANCOR,Dulce de Leche Sancor 400 Gr. ,,"$ 384,20",,960.50KG
Dia,desayuno,ARG,DIA,Galletitas Vainillas DIA 444 Gr. ,,"$ 571,32",,1286.76KG
Dia,desayuno,ARG,SKARCHITOS,Cereales Skarchitos Azucarados 500 Gr. ,,"$ 390,00",,780.00KG
Dia,desayuno,ARG,DIA,Galletas Crackers DIA Salvado 330 Gr. ,,"$ 231,30",,700.91KG
Dia,desayuno,ARG,DIA,Mermelada DIA Frutos Rojos 454 Gr. ,,"$ 456,02",,1004.45KG
Dia,desayuno,ARG,SMAMS,Galletitas rellenas Smams Chocolate sabor vainilla 105 Gr. ,,"$ 228,79",,2178.95KG
Dia,desayuno,ARG,CRIOLLITAS,Criollitas 499 Gr. ,,"$ 386,00",,773.55KG
Dia,desayuno,ARG,DIA,Cápsulas de Café DIA Supremo 50 Gr. ,,"$ 649,00",,12980.00KG
Dia,desayuno,ARG,DIA,Galletitas DIA Pepas de Membrillo 800 Gr. ,9%,"$ 499,00","$ 547,48",623.75KG
Dia,desayuno,ARG,NESCAFE,Café Soluble Nescafé Gold 100 Gr. ,25%,"$ 1.512,97","$ 2.017,29",20172.90KG
Dia,desayuno,ARG,CUQUETS,Galletitas Crackers Cuquets 110 Gr. ,,"$ 75,60",,687.27KG
Dia,desayuno,ARG,NESCAFE,Nescafé Dolca Suave Ideal para Batir 100 Gr. ,25%,"$ 840,13","$ 1.120,17",11201.70KG
Dia,desayuno,ARG,DIA,Té en saquitos DIA 50 Ud. ,,"$ 150,80",,3.02UD
Dia,desayuno,ARG,LA VIRGINIA,Té Clásico La Virginia Naturalidad Intacta 25 Un. ,9%,"$ 103,00","$ 113,61",4.12UD
Dia,desayuno,ARG,LA MORENITA,Cápsulas de Café La Morenita Brasil 10 Un. ,11%,"$ 1.149,00","$ 1.286,34",22096.15KG
Dia,desayuno,ARG,DIA,Galletitas Rellenas DIA Frutilla 140 Gr. ,,"$ 187,00",,1335.71KG
Dia,desayuno,ARG,LA VIRGINIA,Cápsulas La Virginia Expresso 60 Gr. 10 Un. ,13%,"$ 699,00","$ 805,00",11650.00KG
Dia,desayuno,ARG,LA MORENITA,Café en Cápsula La Morenita Etiopía 52 Gr. ,11%,"$ 1.149,00","$ 1.286,34",22096.15KG
Dia,desayuno,ARG,AZUCEL,Azíucar Azucel Común tipo A 1 Kg. ,,"$ 284,17",,284.17KG
Dia,desayuno,ARG,DIA,Galletitas DIA Marmoladas 250 Gr. ,,"$ 204,00",,816.00KG
Dia,desayuno,ARG,DUQUESA,Galletitas Dulces Rellenas con Crema Duquesa de Terrabusi 115 Gr. ,,"$ 98,97",,860.61KG
Dia,desayuno,ARG,NOBLEZA GAUCHA,Yerba Mate Nobleza Gaucha sin tacc 500 Gr. ,,"$ 335,40",,670.80KG
Dia,desayuno,ARG,SONRISAS,Galletitas Sonrisas Frambuesa 108 Gr. ,,"$ 132,70",,1228.70KG
Dia,desayuno,ARG,GRANIX,Granola Crocante Granix 350 Gr. ,,"$ 631,40",,1804.00KG
Dia,desayuno,ARG,GRANIX,Bocaditos Rellenos Granix Crema de Limón 180 Gr. ,,"$ 412,40",,2291.11KG
Dia,desayuno,ARG,LA CAMPAGNOLA,Mermelada La Campagnola Ciruela 454 Gr. ,,"$ 316,10",,696.26KG
Dia,desayuno,ARG,DIA,Yerba Mate Dia Compuesta 500 Gr. ,,"$ 349,10",,698.20KG
Dia,desayuno,ARG,DIA,Mermelada DIA Frambuesa 454 Gr. ,,"$ 456,02",,1004.45KG
Dia,desayuno,ARG,MANA,Galletitas Maná rellenas con Limón 152 Gr. ,,"$ 167,80",,1103.95KG
Dia,desayuno,ARG,MOLINOS ALA,Tostadas de Arroz Molinos Ala Clásicas 120 Gr. ,,"$ 188,55",,1571.25KG
Dia,desayuno,ARG,DONUTS,Galletitas Donuts con Leche 52 Gr. ,,"$ 234,00",,4500.00KG
Dia,desayuno,ARG,SMAMS,Crackers Clásicas Smams 150 Gr. ,,"$ 300,21",,2001.40KG
Dia,desayuno,ARG,PORTEÑITAS,Galletitas Porteñitas 139 Gr. ,,"$ 208,88",,1502.73KG
Dia,desayuno,ARG,TEREPIN,Galletas Pepas Terepin Membrillo 400 Gr. ,,"$ 359,96",,899.90KG
Dia,desayuno,ARG,TERRABUSI,Galletitas Dulces Variedad de Terrabusi Nuevo Mix 390 Gr. ,,"$ 436,33",,1118.79KG
Dia,desayuno,ARG,LA MORENITA,Café Clásico La Morenita 500 Gr. ,,"$ 1.063,82",,2127.64KG
Dia,desayuno,ARG,HILERET 1A10,Edulcorante líquido Hileret Clásico 250 Ml. ,,"$ 328,01",,1312.04LT
Dia,desayuno,ARG,LEDESMA,Azúcar Rubia Mascabo Ledesma 800 Gr. ,,"$ 334,00",,417.50KG
Dia,desayuno,ARG,DIA,Galletitas Anillitos DIA Vainilla 250 Gr. ,,"$ 204,00",,816.00KG
Dia,desayuno,ARG,DIA,Galletitas Dulces DIA Vainilla 140 Gr. ,,"$ 187,00",,1335.71KG
Dia,desayuno,ARG,DIA,Mermelada DIA Arándano 454 Gr. ,,"$ 456,02",,1004.45KG
Dia,desayuno,ARG,DIA,Galletitas DIA Avena con Coco y Dulce de Leche 186 Gr. ,,"$ 259,00",,1392.47KG
Dia,desayuno,ARG,3 ARROYOS,Cereales de Maíz 3 Arroyos 400 Gr. ,,"$ 283,92",,709.80KG
Dia,desayuno,ARG,LA TRANQUERA,Mate Cocido La Tranquera en Saquitos 50 Un. 150 Gr. ,,"$ 264,28",,1761.87KG
Dia,desayuno,ARG,MAÑANITA,Yerba Mate Mañanita 4 Flex 500 Gr. ,,"$ 457,77",,915.54KG
Dia,desayuno,ARG,ZOO CARTOON,Cereal Zoo Cartoon Frutal 150 Gr. ,,"$ 247,18",,1647.87KG
Dia,desayuno,ARG,MANIERI,Tostadas Light Manieri 200 Gr. ,,"$ 227,66",,1138.30KG
Dia,desayuno,ARG,DIA,Obleas Dia Chocolate Blanco y Negro 100 Gr. ,,"$ 106,90",,1069.00KG
Dia,desayuno,ARG,DIA,Obleas Dia Chocolate y Naranja 100 Gr. ,,"$ 106,90",,1069.00KG
Dia,desayuno,ARG,GREEN HILLS,Té Negro Green Hills 50 Un. ,,"$ 346,02",,6.92UD
Dia,desayuno,ARG,HILERET 1A10,Azúcar Light Hileret 250 Gr. ,,"$ 275,87",,1103.48KG
Dia,desayuno,ARG,CUQUETS,Copos de Maíz Azucarados Cuquets 200 Gr. ,,"$ 198,40",,992.00KG
Dia,desayuno,ARG,ARLISTAN,Arlistán Suave 100 Gr. ,,"$ 577,70",,5777.00KG
Dia,desayuno,ARG,DIA,Barra de Arroz DIA 60 Gr. ,,"$ 164,40",,2740.00KG
Dia,desayuno,ARG,9 DE ORO,Galletitas Anillitos 9 de Oro Coco 120 Gr. ,,"$ 100,00",,833.33KG
Dia,desayuno,ARG,DIA,Copos de Maíz DIA 400 Gr. ,,"$ 267,79",,669.48KG
Dia,desayuno,ARG,DIA,Té DIA Manzanilla Sin TACC 25 Un. ,,"$ 99,44",,3.98UD
Dia,desayuno,ARG,CHAMIGO,Yerba Mate Chamigo 500 Gr. ,,"$ 302,17",,604.34KG
Dia,desayuno,ARG,EMETH,Mermelada Emeth Frutos del Bosque Bajas Calorías 420 Gr. ,,"$ 259,82",,618.62KG
Dia,desayuno,ARG,DIA,Galletitas DIA con Chips de Chocolate 90 Gr. ,,"$ 114,24",,1269.33KG
Dia,desayuno,ARG,OREO,Galletitas Dulces Mini OREO Snack 50 Gr. ,,"$ 118,12",,2362.40KG
Dia,desayuno,ARG,DIA,Galletitas DIA Avena con Chips de Chocolate 100 Gr. ,,"$ 128,20",,1282.00KG
Dia,desayuno,ARG,DIA,Miel de abejas DIA 210 Gr. ,,"$ 506,40",,2411.43KG
Dia,desayuno,ARG,NESCAFE,Cápsulas Nestlé Dolce Gusto Cortado 100 Gr. ,,"$ 1.875,78",,16969.25KG
Dia,desayuno,ARG,CRUZ DE MALTA,Yerba Mate Cruz de Malta Tradicional sin tacc 1 Kg. ,,"$ 963,10",,963.10KG
Dia,desayuno,ARG,MANI KING,Manteca De Mani Natural King 350 Gr. ,,"$ 584,70",,1670.57KG
Dia,desayuno,ARG,CABRALES,Café Molido Cabrales Super 125 Gr. ,,"$ 642,79",,5142.32KG
Dia,desayuno,ARG,DIA,Cacao en Polvo DIA 800 Gr. ,,"$ 493,10",,616.38KG
Dia,desayuno,ARG,MANA,Galletitas Maná Vainilla 393 Gr. ,,"$ 392,00",,997.46KG
Dia,desayuno,ARG,NESCAFE,Cápsulas Nestlé Dolce Gusto Expresso 96 Gr. ,,"$ 1.875,78",,19539.38KG
Dia,desayuno,ARG,SMAMS,Pepas Smams Dulce de Membrillo 150 Gr. ,,"$ 387,00",,2580.00KG
Dia,desayuno,ARG,DIA,Bizcochos Azucarados DIA 200 Gr. ,10%,"$ 149,00","$ 166,00",745.00KG
Dia,desayuno,ARG,FLOW CEREAL,Barra de Cereal Flow Frutos del Bosque con Yogur 162 Gr. ,,"$ 810,37",,5002.28KG
Dia,desayuno,ARG,NESCAFE,Nescafé Dolca Original Ideal para Batir 170 Gr. ,25%,"$ 1.165,24","$ 1.553,66",9139.18KG
Dia,desayuno,ARG,MOLINOS ALA,Tostaditas de Arroz Molinos Ala Integral 150 Gr. ,,"$ 306,92",,2046.13KG
Dia,desayuno,ARG,DIA,Galletas María DIA Tripack 360 Gr. ,,"$ 268,10",,893.67KG
Dia,desayuno,ARG,ARCOR,Mermerlada Arcor Naranja 454 Gr. ,,"$ 348,00",,766.52KG
Dia,desayuno,ARG,3 ARROYOS,Aritos 3 Arroyos Avena y Miel 180 Gr. ,,"$ 234,29",,1301.61KG
Dia,desayuno,ARG,LA VIRGINIA,Café Instantáneo La Virginia Suave 170 Gr. ,,"$ 893,40",,5255.29KG
Dia,desayuno,ARG,SMAMS,Galletitas rellenas Smams Vainilla sabor Frutilla 105 Gr. ,,"$ 153,77",,1464.48KG
Dia,desayuno,ARG,LA VIRGINIA,Café Instantáneo Suave La Virginia Clásico Doy Pack 100 Gr. ,,"$ 630,77",,6307.70KG
Dia,desayuno,ARG,LA MORENITA,Café Molido Morenita Intenso 250 Gr. ,,"$ 539,84",,2159.36KG
Dia,desayuno,ARG,INTEGRA,Barra de Cereal Íntegra Chocolate 42 Gr. ,,"$ 170,00",,4250.00KG
Dia,desayuno,ARG,CUQUETS,Copos de Maíz Cuquets 400 Gr. ,,"$ 338,90",,847.25KG
Dia,desayuno,ARG,BC,Mermelada BC Arándano 390 Gr. ,,"$ 676,15",,1733.72KG
Dia,desayuno,ARG,HOGAREÑAS,Galletas Hogareñas Salvado 600 Gr. ,,"$ 423,30",,705.50KG
Dia,desayuno,ARG,TARAGUI,Yerba Mate Taragüi 4 Flex 500 Gr. ,,"$ 382,52",,765.04KG
Dia,desayuno,ARG,DIA,Jalea DIA Membrillo 454 Gr. ,,"$ 451,20",,993.83KG
Dia,desayuno,ARG,NATURA,Yerba Mate Natura Suave 500 Gr. ,,"$ 334,25",,668.50KG
Dia,desayuno,ARG,TERRABUSI,Galletitas Dulces Variedad de Terrabusi Nuevo Mix 590 Gr. ,,"$ 615,90",,1043.90KG
Dia,desayuno,ARG,TURIMAR,Mini Galletitas con Chips Turimar 32 Gr. ,,"$ 105,30",,2106.00KG
Dia,desayuno,ARG,OKEBON,Galletitas Okebon Clásicas con Leche ,,"$ 136,53",,827.45KG
Dia,desayuno,ARG,DIA,Edulcorante Líquido DIA 500 Ml. ,,"$ 419,75",,839.50LT
Dia,desayuno,ARG,GALLO (SNACK),Galleta de Arroz Gallo Snacks Limón 100 Gr. ,,"$ 335,00",,3350.00KG
Dia,desayuno,ARG,UNION,Yerba Mate Unión Suave 4 Flex 500 Gr. ,,"$ 392,14",,784.28KG
Dia,desayuno,ARG,AMANDA,Yerba Mate Amanda Suave 500 Gr. ,9%,"$ 469,00","$ 513,95",938.00KG
Dia,desayuno,ARG,DIA,Galletitas DIA Chocolate y Vainilla rellenas de Membrillo 400 Gr. ,,"$ 429,60",,1074.00KG
Dia,desayuno,ARG,GALLO (SNACK),Galleta de Arroz Gallo Snacks Chocolate 100 Gr. ,,"$ 335,00",,3350.00KG
Dia,desayuno,ARG,NESQUIK,Cacao en Polvo Nesquik chocolatado 150 Gr. ,,"$ 339,00",,2260.00KG
Dia,desayuno,ARG,DIA,Galletitas Crackers DIA Clásicas 330 Gr. 3 Un. ,,"$ 211,87",,642.03KG
Dia,desayuno,ARG,LA VIRGINIA,Café Instantáneo Suave La Virginia Clásico Doy Pack 100 Gr. ,,"$ 630,77",,6307.70KG
Dia,desayuno,ARG,DIA,Café Molido DIA Intenso 500 Gr. ,,"$ 725,10",,1450.20KG
Dia,desayuno,ARG,GRANIX,Copos de Maíz Granix 160 Gr. ,,"$ 241,79",,1511.19KG
Dia,desayuno,ARG,DIA,Oblea DIA Frutilla 100 Gr. ,,"$ 123,43",,1234.30KG
Dia,desayuno,ARG,NESCAFE,Nescafé Dolca Suave Perfecto para batir 100 Gr. ,25%,"$ 840,13","$ 1.120,17",11201.70KG
Dia,desayuno,ARG,DIA,Obleas DIA Limón 100 Gr. ,,"$ 123,43",,1234.30KG
Dia,desayuno,ARG,CRIOLLITAS,TOSTADAS CLASICAS CRIOLLITAS 200GR ,,"$ 207,12",,1062.15KG
Dia,desayuno,ARG,DIA,Galletitas Pepas DIA Frutos del Bosque 500 Gr. ,,"$ 329,00",,658.00KG
Dia,desayuno,ARG,ILOLAY,Dulce de Leche repostero Ilolay 405 Gr. ,,"$ 480,60",,1186.67KG
Dia,desayuno,ARG,CORMILLOT,Galletitas de Avena Cormillot con Semillas 160 Gr. ,,"$ 204,30",,1276.88KG
Dia,desayuno,ARG,ROSAMONTE,Yerba Mate Rosamonte Edición 55 Aniversario 500 Gr. ,,"$ 473,34",,946.68KG
Dia,desayuno,ARG,FLOW CEREAL,Barra de Cereal Flow Manzana 126 Gr. ,,"$ 810,37",,6431.51KG
Dia,desayuno,ARG,DIA,Bizochos de Grasa DIA 200 Gr. ,10%,"$ 149,00","$ 166,00",745.00KG
Dia,desayuno,ARG,BONAFIDE,Donuts Bonafide Chocolate Blanco 52 Gr. ,,"$ 234,00",,4500.00KG
Dia,desayuno,ARG,DIA,Galletitas Mini Crackers DIA Salvado 300 Gr. ,,"$ 209,00",,696.67KG
Dia,desayuno,ARG,ARLISTAN,Café Arlistan Sustentable 170 Gr. ,,"$ 1.317,89",,7752.29KG
Dia,desayuno,ARG,DIA,Té DIA Hierbas Sin TACC 25 Un. ,,"$ 128,18",,5.13UD
Dia,desayuno,ARG,OKEBON,Galletitas Okebon Girotondo Chocolate 254 Gr. ,,"$ 183,28",,721.57KG
Dia,desayuno,ARG,TARAGUI,Yerba Mate Taragui Sin Palo 1 Kg. ,,"$ 895,19",,895.19KG
Dia,desayuno,ARG,SIN MARCA,Mini Triangulitos Azucarados 180 Gr. ,,"$ 149,10",,828.33KG
Dia,desayuno,ARG,QUAKER,Avena Tradicional Quaker 550 Gr. ,,"$ 658,62",,1197.49KG
Dia,desayuno,ARG,MACARENA,Triangulitos Hojaldre Macarena 100 Gr. ,,"$ 237,40",,2374.00KG
Dia,desayuno,ARG,LA VIRGINIA,Té La Virginia Manzanilla 25 Un. ,,"$ 177,68",,7.11UD
Dia,desayuno,ARG,HILERET 1A10,Edulcorante Líquido Hileret Mate 400 Ml. ,,"$ 567,77",,1419.43LT
Dia,desayuno,ARG,LA MORENITA,Café Torrado Molido Morenita en Saquitos 20 Un. ,,"$ 489,48",,97896.00KG
Dia,desayuno,ARG,TURIMAR,Mini Bizcochitos Turimar 32 Gr. ,,"$ 80,50",,1610.00KG
Dia,desayuno,ARG,OKEBON,Galletitas Panal Okebon Chocolate 242 Gr. ,,"$ 208,46",,861.40KG
Dia,desayuno,ARG,RUMBA,Galletitas Rumba Original 3 Ud. ,,"$ 509,81",,1517.29KG
Dia,desayuno,ARG,HOJALMAR,Snack Matero Salado Hojalmar 180 Gr. ,,"$ 232,20",,1290.00KG
Dia,desayuno,ARG,EXQUISITA,Polvo Chocolatado Exquisita 360 Gr. ,,"$ 756,82",,2102.28KG
Dia,desayuno,ARG,9 DE ORO,Galletas de Avena 9 de Oro Yogur Frutilla 180 Gr. ,,"$ 225,00",,1250.00KG
Dia,desayuno,ARG,LA MORENITA,Café Molido La Morenita Intenso 125 Gr. ,,"$ 296,51",,2372.08KG
Dia,desayuno,ARG,RONDA,Larguitas de Hojaldre Ronda 150 Gr. ,,"$ 215,00",,1433.33KG
Dia,desayuno,ARG,CORMILLOT,Galletitas Cormillot con Chips de Chocolate 160 Gr. ,,"$ 215,00",,1343.75KG
Dia,desayuno,ARG,TIA MARUCA,Galletitas Saladas Crackers Tia Maruca Salvado 210 Gr. ,,"$ 156,14",,743.52KG
Dia,desayuno,ARG,TARAGUI,Té Taragui Diamantado 50 Un. ,,"$ 239,36",,4.79UD
Dia,desayuno,ARG,OREO,Galletitas Dulces Rellenas con Crema OREO Vainilla 118 Gr. ,,"$ 280,19",,2374.49KG
Dia,desayuno,ARG,9 DE ORO,Granola 9 de Oro 180 Gr. ,,"$ 198,30",,1101.67KG
Dia,desayuno,ARG,DIA,Oblea DIA Chocolate 100 Gr. ,,"$ 123,43",,1234.30KG
Dia,desayuno,ARG,MAIZENA,Granola Maizena con Almendras y Arándanos 180 Gr. ,,"$ 677,40",,3763.33KG
Dia,desayuno,ARG,CRYSF,Café en Saquitos Crysf 20 Un. ,,"$ 458,45",,22.92UD
Dia,desayuno,ARG,ZAFRA,"Galletitas Zafran Cacao, Mani y Café 28 Gr. ",,"$ 75,00",,2678.57KG
Dia,desayuno,ARG,TRIO,Galletitas Trichips Trio 300 Gr. ,,"$ 349,80",,1166.00KG
Dia,desayuno,ARG,LEIVA,Galletas Sandwich Leiva 110 Gr. ,,"$ 108,36",,985.09KG
Dia,desayuno,ARG,9 DE ORO,Bizcochito Light 9 de Oro 170 Gr. ,,"$ 190,68",,1121.65KG
Dia,desayuno,ARG,CORMILLOT,Galletitas de Avena Cormillot con Cacao 160 Gr. ,,"$ 204,30",,1276.88KG
Dia,desayuno,ARG,SIN MARCA,Bizcochitos Azucarados 180 Gr. ,,"$ 149,10",,828.33KG
Dia,desayuno,ARG,TURIMAR,Mini Mantekitas Turimar 32 Gr. ,,"$ 68,10",,2128.13KG
Dia,desayuno,ARG,SANCOR,Dulce de leche tradicional Sancor 250 Gr. ,,"$ 311,50",,1246.00KG
Dia,desayuno,ARG,LA TRANQUERA,Yerba Mate La Tranquera Selección Especial 500 Gr. ,,"$ 410,55",,821.10KG
Dia,desayuno,ARG,CRUZ DE MALTA,Yerba Tradicional Cruz de Malta sin tacc 500 Gr. ,,"$ 505,89",,1011.78KG
Dia,desayuno,ARG,MANA,Galletitas Mana Sabor Vainilla 136 Gr. ,,"$ 136,74",,1005.44KG
Dia,desayuno,ARG,GAONA,Galletitas Cubicub Gaona Volcán de Chocolate 100 Gr. ,,"$ 154,80",,1548.00KG
Dia,desayuno,ARG,TARAGUI,Mate Cocido Taragui Diamantado 50 Un. ,,"$ 317,44",,6.35UD
Dia,desayuno,ARG,GAONA,Cubicub Frutilla Gaona 100 Gr. ,,"$ 159,75",,1597.50KG
Dia,desayuno,ARG,ZUCARITAS,Cereal Zucaritas Kellogg's Chocolate 270 Gr. ,,"$ 469,55",,1739.07KG
Dia,desayuno,ARG,9 DE ORO,Galletas de Avena 9 de Oro Yogur Vainilla 180 Gr. ,,"$ 225,00",,1250.00KG
Dia,desayuno,ARG,GAONA,Galletitas Crunchips Gaona 120 Gr. ,,"$ 154,80",,1290.00KG
Dia,desayuno,ARG,TARAGUI,Té Taragui sin ensobrado 25 Un. ,,"$ 128,45",,5.14UD
Dia,desayuno,ARG,GALLO (SNACK),Galletitas Gallo Snack Sabor Crema y Cebolla 100 Gr. ,,"$ 267,00",,2670.00KG
Dia,desayuno,ARG,HILERET 1A10,EDULCO CLASICO FORTE HILERET 80GR ,,"$ 490,72",,6134.00KG
Dia,desayuno,ARG,DIA,Cereales Copos de Maíz DIA Azucarados 200 Gr. ,,"$ 150,63",,753.15KG
Dia,desayuno,ARG,GALLETAS NS,Galletas Marineras Con Sal 350 Gr. ,,"$ 381,96",,1091.31KG
Dia,desayuno,ARG,DIA,Galletitas Avena Dia con Pasas de Uva 100 Gr. ,,"$ 128,20",,1282.00KG
Dia,desayuno,ARG,CORMILLOT,Galletitas Cormillot de Avena con Pasas de Uva 160 Gr. ,,"$ 215,00",,1343.75KG
Dia,desayuno,ARG,LA MERCED,Yerba Mate La Merced de Campo 500 Gr. ,,"$ 730,98",,1461.96KG
Dia,desayuno,ARG,9 DE ORO,Galletas de Avena 9 de Oro con Pasas 180 Gr. ,,"$ 225,00",,1250.00KG
Dia,desayuno,ARG,LA MORENITA,Café Molido Torrado La Morenita Italiano 250 Gr. ,,"$ 844,83",,3379.32KG
Dia,desayuno,ARG,MANA,Galletitas Maná rellenas con Chocolate 152 Gr. ,,"$ 175,54",,1154.87KG
Dia,desayuno,ARG,PARNOR,Galletitas Mini Chippis Parnor con Chips de Chocolate 120 Gr. ,,"$ 252,80",,2106.67KG
Dia,desayuno,ARG,OREO,Oreo Bañadas Chocolate 119 Gr. ,,"$ 652,22",,5480.84KG
Dia,desayuno,ARG,HILERET 1A10,Edulcorante Hileret Zucra Forte 80 Gr. ,,"$ 736,85",,9210.63KG
Dia,desayuno,ARG,LEDESMA,Edulcorante Stevia Ledesma 96 sobres ,,"$ 670,11",,8725.39KG
Dia,desayuno,ARG,PAJARO AZUL,Yerba Mate Pájaro Azul 500 Gr. ,,"$ 446,95",,893.90KG
Dia,desayuno,ARG,GALLETAS NS,Galletas 5 Cereales 350 Gr. ,,"$ 381,96",,1091.31KG
Dia,desayuno,ARG,DIA,Té Boldo Dia en Saquitos 25 Un. ,,"$ 211,94",,8.48UD
Dia,desayuno,ARG,DIA,Galletitas Dulces DIA Frambuesa 140 Gr. ,,"$ 200,21",,1430.07KG
Dia,desayuno,ARG,LA CAMPAGNOLA,Mermelada BC Ciruela 390 Gr. ,,"$ 599,00",,1535.90KG
Dia,desayuno,ARG,EXQUISITA,Polvo Exquisita Chocolatado 180 Gr. ,,"$ 342,30",,1901.67KG
Dia,desayuno,ARG,DIA,Galletitas DIA Avena y Pasas de Uva 186 Gr. ,,"$ 259,00",,1392.47KG
Dia,desayuno,ARG,ROSAMONTE,Yerba Mate Rosamonte Suave Edición 55 Aniversario 500 Gr. ,,"$ 518,09",,1036.18KG
Dia,desayuno,ARG,RICHMOND,Café Molido Richmond 150 Gr. ,,"$ 680,17",,4534.47KG
Dia,desayuno,ARG,HOGAREÑAS,Galletas Hogareñas Salvado 200 Gr. ,,"$ 144,27",,721.35KG
Dia,desayuno,ARG,LA VIRGINIA,Café en Saquitos La Virginia 20 Un. ,,"$ 573,91",,28.70UD
Dia,desayuno,ARG,9 DE ORO,Galletitas Pepas 9 de Oro Integrales 140 Gr. ,,"$ 114,19",,815.64KG
Dia,desayuno,ARG,PARNOR,Galletitas Parnor Coco 170 Gr. ,,"$ 202,48",,1191.06KG
Dia,desayuno,ARG,ZUCARITAS,Cereales Kellog's Zucaritas 120 Gr. ,,"$ 341,63",,2846.92KG
Dia,desayuno,ARG,DALE,Galletitas Rellena Dale Frutilla 81 Gr. ,,"$ 82,56",,1019.26KG
Dia,desayuno,ARG,CHOCOLINO,Cacao Chocolino Plus sin tacc 180 Gr. ,,"$ 284,42",,1580.11KG
Dia,desayuno,ARG,BONAFIDE,Café Bonafide Suave 125 Gr. ,,"$ 382,38",,3059.04KG
Dia,desayuno,ARG,ZUPAY,Galletitas Zupay Mantequitas 200 Gr. ,,"$ 219,00",,1095.00KG
Dia,desayuno,ARG,PAJARO AZUL,Yerba Mate Pájaro Azul 1 Kg. ,,"$ 922,92",,922.92KG
Dia,desayuno,ARG,9 DE ORO,Galletitas 9 de Oro Brigitte rellenas Chocolate 160 Gr. ,,"$ 165,24",,1032.75KG
Dia,desayuno,ARG,TRIX,Cereales Trix Frutados 230 Gr. ,,"$ 787,32",,3423.13KG
Dia,desayuno,ARG,DIA,Obleas DIA Vainilla 100 Gr. ,,"$ 123,43",,1234.30KG
Dia,desayuno,ARG,LA MORENITA,Cápsulas de Café La Morenita Etiopía 10 Un. ,,"$ 619,00",,11903.85KG
Dia,desayuno,ARG,MAÑANITA,Yerba Mate Mañanita 4 Flex 1 Kg. ,,"$ 933,46",,933.46KG
Dia,desayuno,ARG,NOBLEZA GAUCHA,Mate Cocido Nobleza Gaucha 50 Un. ,,"$ 299,00",,5.98UD
